Unnamed: 0,headlines,date,time,author,read_more,image_url,ctext,summary
38,Wikipedia to not comply with UK online safety bill's age checks,2023-04-30,03:22 pm,Srishty Choudhury,https://www.independent.co.uk/tech/wikipedia-age-verification-online-safety-rules-whatsapp-b2329023.html?utm_campaign=fullarticle&utm_medium=referral&utm_source=inshorts ,https://static.inshorts.com/inshorts/images/v1/variants/jpg/m/2023/04_apr/30_sun/img_1682845471944_306.jpg,"Wikipedia could be banned in the UK after it committed not to comply with the upcoming Online Safety Bill.The controversial legislation has already drawn similar responses from companies such as WhatsApp, which also said that it would not abide by new rules and could be forced out of the country as a result.Wikipedia’s specific objections come to parts of the bill that require websites that include content that could be harmful to children to include age verification checks. The Wikimedia Foundation, which runs Wikipedia, said that it fears that some content – such as educational content about sexuality – could be included in that.If that does happen, and it is asked to include age verification checks, it would refuse to comply. Rebecca MacKinnon, from the Wikimedia Foundation, told that BBC that doing so would “violate our commitment to collect minimal data about readers and contributors”.That in turn could leave the app facing sanctions in the UK, and that it could be blocked in the country if it does not comply.It has already said that the website could lead to major problems with the way the site operates, given the vast amount of new content that is being added all the time and the difficulty in moderating it. It has said the Online Safety Bill would also cause problems by forcing it to moderate articles, rather than the volunteers that currently do so.In the House of Lords this week, heritage minister Lord Parkinson said that the bill would probably not include Wikipedia and that it was focused on “only services which pose the highest risk to children will use age verification technologies”.But Lucy Crompton-Reid, from Wikimedia UK which is affiliated with the foundation, told the BBC that the remarks were reassuring but that it did not want to rely on the goodwill of the government.As such, she said it was “definitely possible that one of the most visited websites in the world - and a vital source of freely accessible knowledge and information for millions of people - won’t be accessible to UK readers (let alone UK-based contributors)”.Ms Crompton-Reid’s concerns echoes comments from messaging apps, which have expressed concerns about other parts of the bill. Platforms such as WhatsApp and Signal have said that the legislation could require them to be able to moderate all messages that are passed through their systems – a requirement that would be technically unfeasible because of security settings that they have committed not to weaken.The government has said that the bill is not intended to weaken that security, and has occasionally suggested that the end-to-end encryption technology that powers those apps will still be allowed. But they have argued that those assurances should be written into the legislation, so that the powers in the law cannot be abused at a later date.As such, Signal, WhatsApp and others have said they will leave the UK before they comply with any requirements to weaken their security features.The announcement came shortly after the Wikimedia Foundation was punished by a Russian court over an article about the war in Ukraine. Wikimedia was fined two million roubles ($24,510) for not deleting what Russia said was “banned content” related to the Russian military, Interfax reported.It said this was the seventh fine imposed on Wikimedia in 2023 for not removing prohibited information. The fines now total 8.4 million roubles.The latest penalty was for not removing an article about a military unit that contained “classified military information” about its location, composition and equipment, including information related to the progress of what Russia calls its special military operation in Ukraine.Wikimedia did not immediately respond to a request for comment. It has previously said information that Russian authorities complained about was well-sourced and in line with Wikipedia standards.Wikipedia is one of the few surviving independent sources of information in Russian since a state crackdown on online content intensified after Moscow invaded Ukraine last year.“We are not blocking Wikipedia yet, there are no such plans for now,” Interfax quoted digital affairs minister Maksut Shadaev as saying last week.Additional reporting by Reuters","Wikimedia Foundation says it will refuse to comply with the Online Safety Bill. It fears that age verification checks could include educational content. WhatsApp, Signal and others have said they will leave the UK before they comply with any requirements to weaken their security features. It comes after the Wikimedia Foundation was punished by a Russian court over an article about the war in Ukraine."
39,Amazon manager making TikTok video accidentally records moment she got fired,2023-04-30,11:03 am,Hiral Goyal,https://www.independent.co.uk/life-style/wes-anderson-tiktok-fired-amazon-b2327865.html?utm_campaign=fullarticle&utm_medium=referral&utm_source=inshorts ,https://static.inshorts.com/inshorts/images/v1/variants/jpg/m/2023/04_apr/30_sun/img_1682831421157_946.jpg,"A content creator has made a TikTok video of the moment she was told via email that she had been laid off, in the style of director Wes Anderson.Jen Lucas, who runs a TikTok account called Jen and Evee, posted a new clip on Wednesday (26 April) inspired by the current trend on the social media platform that emulates the Grand Budapest Hotel filmmaker’s signature style.However, while she was filming the video, she claimed to accidentally capture the moment she discovered she had been laid off from her job at Amazon.The clip begins with her standing while hitting her head against a wall in front of her. Text over the video reads: “I was trying to film a cute Wes Anderson-style WFH [work from home] and accidentally filmed myself getting laid off??!”It was followed by a title sequence that read: “Getting laid off from my job. What the f***.”Viewers then see Lucas going through her morning routine, from getting out of bed to making a cup of coffee to brushing her teeth.She then boots up her computer to start her work day. However, one clip shows her placing her hand over her mouth in shock as she stares at her screen, with text explaining: “Real time opening the email.”Jen then went on a “mental health walk” with her husband and dog, and the last clip shows her walking with her corgi down a road with the text: “Onward to better things.”In the caption, she wrote: “I debated if I should even post this, but if you got laid off too just know you’re not alone.”It comes as Amazon began laying off employees in its cloud computing and human resources divisions this week, with the company slashing costs to stay on top of a slowdown in growth in its retail business and the economic downturn caused by inflation and wage stagnation.The online retail mammoth announced job cuts earlier this year that were expected to affect 18,000 staffers.In a follow-up video, Jen explained that she was “really surprised” to find out she was one of the many employees whose job was affected by the cuts, as she had been working for Amazon for eight years.“I got promoted twice last year, I had an amazing review just a month ago,” she said. “I know it’s not about my performance or who I am as an employee, but that doesn’t make it suck any less.“Part of me is glad to be out glad to be out of this extremely toxic environment and the other part feels like failure and a disappointment and hates that I have to tell people that I got laid off from my job, but that is life and I am human and this does not make me any less amazing or valuable or smart.“I know I’m gonna land on my feet, I know I’m gonna be fine. But this sucks. Like, this is a top 10 bad feeling.”Commenting on her original video, fans noted that it was “peak Wes Anderson” as the filmmaker often focuses on themes of loss.“This is millennial core right now, Wes Anderson and everyone getting laid off,” one person wrote.Another said: “Honestly it’s so much more Wes Anderson this way.”","Jen Lucas, who runs a TikTok account called Jen and Evee, posted a new clip inspired by the current trend on the social media platform that emulates the Grand Budapest Hotel filmmaker’s signature style. While filming the video, she claimed to accidentally capture the moment she discovered she had been laid off from her job at Amazon."
40,Engineer claims Chrome's Dino game hack got him interview at Google,2023-04-30,08:46 pm,Pragya Swastik,https://www.hindustantimes.com/trending/man-claims-chrome-dino-game-hack-landed-him-an-interview-at-google-101682676972435-amp.html?utm_campaign=fullarticle&utm_medium=referral&utm_source=inshorts ,https://static.inshorts.com/inshorts/images/v1/variants/jpg/m/2023/04_apr/30_sun/img_1682865881950_221.jpg,"
During an internet outage or simply as a fun distraction, Chrome users often play Google’s Dino Game. The simple endless running game is played using the spacebar and arrow keys on keyboard. Now, a man took to Twitter to share how a simple hack for the game landed him an interview with the tech giant Google. Expectedly, the man’s tweet featuring the hack went viral, leaving many impressed.Also Read| Viral Brain Teaser: Can you spot a cat hidden in plain sight among owls?




Do you play Google’s Dino Game when there is no Internet connectivity?(Representational Image: Unsplash/Addy Osmani )








Twitter user Akshay Narisetti shared a video featuring a hack of Chrome Dino Game and wrote, “This Project got me an interview at Google.” Using Arduino - a microcontroller, Narisetti was able to program a device to press the spacebar, allowing the dinosaur to jump over every obstacle in the game without fail. He even ended up scoring 300.Watch the video below:










The post was shared a day ago on Twitter and went crazy viral online with over 13.4 million views. The share has also accumulated lakhs of likes and comments.Here’s how people reacted to the tweet:
An individual enquired about the project and wrote, “This is amazing ! If possible, may I know what resources you used to learn and also how you came up with the idea? Thank You!” To this, the original poster replied, “The idea itself might not be original, but the implementation is, electronics is how I learnt coding. I first coded on an Arduino before coding on an actual computer. I got to embrace the computer capabilities that way. Then rest is curiosity in all kinds of technology.”






“Wow, really impressive. This was the coolest thing I’ve seen on my twitter feed this entire week. Congratulations!” posted another. A third wrote, “I guess seeing this (Chrome Dino Game hack) around 2020/21... on LinkedIn and it went viral. Tbh.” To this, Narisetti replied in agreement. He wrote, “Haha that was me!” “So.... did you get the job?” a fourth asked with curiosity.Also Read: Man claims Jeff Bezos attended Coachella wearing $15 shirt from Amazon, people react

SHARE THIS ARTICLE ON















ABOUT THE AUTHOR









Arfa Javaid



Arfa Javaid is a journalist working with the Hindustan Times' Delhi team. She covers trending topics, human interest stories, and viral content online....view detail









Topics

google
its viral
viral video
+ 1 more





","Twitter user Akshay Narisetti shared a video featuring a hack of Chrome Dino Game. The post was shared a day ago on Twitter and went crazy viral online with over 13.4 million views. Using an Arduino - a microcontroller, he was able to program a device to press the spacebar, allowing the dinosaur to jump over every obstacle in the game."
41,"Silly, very un-Apple: Some workers on Apple's back-to-office drive",2023-04-29,05:49 pm,Ananya Goyal,https://www.hindustantimes.com/technology/tim-cook-apple-ceo-return-to-office-hybrid-work-from-home-101682761302080-amp.html?utm_campaign=fullarticle&utm_medium=referral&utm_source=inshorts ,https://static.inshorts.com/inshorts/images/v1/variants/jpg/m/2023/04_apr/29_sat/img_1682768261978_722.jpg,"
Apple chief executive officer (CEO) Tim Cook's back-to-office drive has upset a section of employees in his company. In March, the Cupertino-based giant in an email had told the employees that action will be taken against those not going to office at least three days in a week.




Tim Cook (AFP)








A group of Apple employees calling themselves ‘Apple Together’ have shared a Twitter petition arguing that the staff had shown they could do exceptional work while staying at home, Tech Insider reported.
The website was told that there is a Slack channel advocating remote work with more than 10,000 employees. An employee said there is no confusion how a large percentage of staffers feel and that the iPhone maker has this information for a couple of years. Last year, Cook in a memo to the employees had said the revised framework would enhance the employees' ability to work flexibly while preserving the ‘in-person’ collaboration which was essential to the company's culture. In an open letter signed by more than 1,250 people on the ‘Apple Together’ website, the employees have demanded location-flexible work.






An employee who left Apple as per her LinkedIn profile, claimed the company's return-to-office policy had forced her to leave. The ex-employee told the website she struggled to commute from SW Austin and felt she was more productive at home.
According to a person familiar with the development, the company had promoted the ‘return-to-office’ policy to collaborate and generate ‘creative friction’. But this person termed the policy as ‘nonsense’ for most globally distributed terms, the Tech Insider report added.
The employees said the company's explanation that it operated that way is both ‘silly’ and ‘un-Apple’, which is opposite of innovation. The company had mailed a survey to the employees seeking their views on hybrid work which was supposed to close on April 28.







SHARE THIS ARTICLE ON















ABOUT THE AUTHOR









Aryan Prakash



Multimedia journalist with over nine years of experience in print, television and digital media. Books, politics and cinema are an inseparable part of life....view detail









Topics

tim cook
apple inc.





","In March, the Cupertino-based giant in an email had told the employees that action will be taken against those not going to office at least three days in a week. A group of Apple employees calling themselves ‘Apple Together’ have shared a Twitter petition arguing that the staff had shown they could do exceptional work while staying at home."
42,Italy restores ChatGPT after OpenAI addresses privacy concerns,2023-04-29,12:00 pm,Ananya Goyal,https://www.reuters.com/technology/chatgpt-is-available-again-users-italy-spokesperson-says-2023-04-28/?utm_campaign=fullarticle&utm_medium=referral&utm_source=inshorts ,https://static.inshorts.com/inshorts/images/v1/variants/jpg/m/2023/04_apr/29_sat/img_1682747634387_485.jpg,"April 28 (Reuters) - The ChatGPT chatbot was reactivated in Italy after its maker OpenAI addressed issues raised by Italy's data protection authority, the agency and the company confirmed on Friday.Microsoft Corp (MSFT.O)-backed OpenAI took ChatGPT offline in Italy last month after the country's data protection authority, also known as Garante, temporarily banned the chatbot and launched a probe over the artificial intelligence application's suspected breach of privacy rules.Garante had given a deadline till Sunday to OpenAI to address its concerns for allowing the chatbot to start operating again in the country.Last month, Garante said ChatGPT has an ""absence of any legal basis that justifies the massive collection and storage of personal data"" to ""train"" the chatbot.Garante had also accused OpenAI of failing to check the age of ChatGPT's users who are supposed to be aged 13 or above, OpenAI said it will offer a tool to verify users' ages in Italy upon sign-up.The company said on Friday it will provide greater visibility of its privacy policy and user content opt-out form.It will also provide a new form for European Union users to exercise their right to object to its use of personal data to train its models, a company spokesperson said.The form requires people who want to opt out to provide detailed personal information, including evidence of data processing via relevant prompts.Garante said it recognises the steps taken to combine technological progress with respect to people's rights and hopes that the company will continue along this path of compliance with European data protection regulations.Italy was the first western European country to curb ChatGPT, but its rapid development has attracted attention from lawmakers and regulators in several countries.A committee of European Union lawmakers on Thursday agreed on new rules that would force companies deploying generative AI tools, such as ChatGPT, to disclose any copyrighted material used to develop their systems.Following Garante's interest in ChatGPT, European Data Protection Board, the body that unites Europe's national privacy watchdogs, set up a task force on the chatbot earlier this month.Garante said it will continue its probe of ChatGPT and will work with the special task force.Our Standards: The Thomson Reuters Trust Principles.","The ChatGPT chatbot was reactivated in Italy after its maker OpenAI addressed issues raised by Italy's data protection authority. Last month, Garante temporarily banned the chatbot and launched a probe over the artificial intelligence application's suspected breach of privacy rules. The company said on Friday it will provide greater visibility of its privacy policy and user content opt-out form."
43,Bill to ban AI from launching nuclear weapons introduced in US,2023-04-29,04:13 pm,Mansi Agarwal,https://www.news18.com/amp/tech/us-lawmakers-introduce-bill-to-ban-ai-from-launching-nuclear-weapons-7672555.html?utm_campaign=fullarticle&utm_medium=referral&utm_source=inshorts ,https://static.inshorts.com/inshorts/images/v1/variants/jpg/m/2023/04_apr/29_sat/img_1682761734020_41.jpg,"A group of US lawmakers have proposed a bill to stop artificial intelligence (AI)-driven autonomous systems from single-handedly launching nuclear weapons, as fears arise on the potential threat of AI taking a decision on its own.Senator Edward Markey (D-MA) and Representatives Ted Lieu (D-CA), Don Beyer (D-VA), and Ken Buck (R-CO) have introduced the ‘Block Nuclear Launch by Autonomous AI Act’ in the US, reports The Verge.The bill would “prohibit the use of Federal funds to launch a nuclear weapon using an autonomous weapons system that is not subject to meaningful human control"".“In all cases, the US will maintain a human ain the loop’ for all actions critical to informing and executing decisions by the President to initiate and terminate nuclear weapon employment,"" read the bill.The Senators feel that it is the sense of Congress that the use of lethal, autonomous nuclear weapons systems that are not subject to meaningful human control cannot properly adhere to international humanitarian law and “any decision to launch a nuclear weaponAshould not be made by AI"".An earlier ‘National Security Commission on Artificial Intelligence’ report recommended affirming a ban on autonomous nuclear weapons launches, “not only to prevent it from happening inside the US government but to spur similar commitments from China and Russia"", the report mentioned.Twitter Blue Struggles To Retain Subscribers As Users Struggle To Find Value: ReportGoogle Bard Is Now Available For Workspace Users, But There's A Caveat: All DetailsA large-scale nuclear war would lead to the deaths of millions of people, firestorms, radioactive fallout contamination, agricultural failure, and catastrophic climate results.“Compliance with international humanitarian law, human control and human legal judgment is essential in the nuclear command and control process,"" the bill stressed.The 2022 Nuclear Posture Review states that “in all cases, the US will maintain a human ain the loop’ for all actions critical to informing and executing decisions by the President to initiate and terminate nuclear weapon employment"".Read all the Latest Tech News here(This story has not been edited by News18 staff and is published from a syndicated news agency feed)About the Author","A group of US lawmakers have proposed a bill to stop artificial intelligence (AI)-driven autonomous systems from single-handedly launching nuclear weapons. The bill would ‘prohibit the use of Federal funds to launch a nuclear weapon using an autonomous weapons system that is not subject to meaningful human control"" A large-scale nuclear war would lead to the deaths of millions of people."
44,Twitter to take 10% cut on content subscriptions after 1 year,2023-04-29,11:17 am,Ananya Goyal,https://www.hindustantimes.com/technology/elon-musk-twitter-to-cut-10-content-subscription-after-1-year-101682725582039-amp.html?utm_campaign=fullarticle&utm_medium=referral&utm_source=inshorts ,https://static.inshorts.com/inshorts/images/v1/variants/jpg/m/2023/04_apr/29_sat/img_1682745641270_144.jpg,"
Twitter Inc CEO Elon Musk said on Friday that the social media platform will take a 10% cut on content subscriptions after the first year, as the company looks to monetize content on the website in a bid to diversify its revenue sources.




Musk has been bringing in changes at Twitter to boost revenue.(REUTERS)








Earlier this month, billionaire owner Musk said users of the social media platform will be able to offer their followers subscriptions to content, including long-form text and hours-long video.
He had also said that the company will not take a cut for the first 12 months on content subscriptions.Read: Verified Twitter accounts now ‘prioritised’: Elon Musk
Musk has been bringing in changes at Twitter to boost revenue after the platform saw advertising income drop last year in the run up to his $44 billion acquisition that closed in October.
He added that the company's cut from subscriptions on iOS and Android platforms will drop to 15% in the second year from 30% in the first.

SHARE THIS ARTICLE ON










Topics

elon musk
twitter





",Twitter Inc CEO Elon Musk said on Friday that the social media platform will take a 10% cut on content subscriptions after the first year. Musk has been bringing in changes at Twitter to boost revenue after the platform saw advertising income drop last year in the run up to his $44 billion acquisition.
45,OpenAI raises $300 mn at $27 bn-$29 bn valuation: Report,2023-04-29,08:50 am,Ananya Goyal,https://www.reuters.com/markets/deals/openai-closes-10-bln-funding-round-27-bln-29-bln-valuation-techcrunch-2023-04-28/?utm_campaign=fullarticle&utm_medium=referral&utm_source=inshorts ,https://static.inshorts.com/inshorts/images/v1/variants/jpg/m/2023/04_apr/29_sat/img_1682736988075_430.jpg,"April 28 (Reuters) - OpenAI, the company behind the ChatGPT chatbot, has closed a more than $300 million share sale at a valuation between $27 billion and $29 billion, TechCrunch reported on Friday.(This story has been corrected to say a $300 million share sale, not $10 billion or $10.3 billion, in the headline and paragraph 1)Our Standards: The Thomson Reuters Trust Principles.","OpenAI, the company behind the ChatGPT chatbot, has closed a more than $300 million share sale at a valuation between $27 billion and $29 billion, TechCrunch reported. The company is also working on a chatbot that will be called Chatbot."
